content,expected_title
"A person named David overcame obstacles. Through this experience, they learned that perseverance pays off. Eventually, they helped their community.",Lessons in Perseverance Pays Off
In the depths of arctic tundra. nature revealed its secrets. Local inhabitants witnessed natural phenomena.,Discovery in Arctic Tundra
"During a challenging time, Lisa faced a difficult decision. Through this experience, they learned that kindness matters. Eventually, they helped their community.",Path to Kindness Matters
Deep within desert landscape. nature revealed its secrets. Researchers observed natural phenomena.,Secrets of Desert Landscape
Engineers from research institute developed breakthrough technology. The innovation could revolutionize industries.,Innovation: Developed
In the depths of mountain range. nature revealed its secrets. Local inhabitants witnessed natural phenomena.,Mysteries of Mountain Range
"In a small town, Michael faced a difficult decision. Through this experience, they learned that change brings growth. Eventually, they helped their community.",Path to Change Brings Growth
Across the vast arctic tundra. nature revealed its secrets. Local inhabitants witnessed ecological patterns.,Mysteries of Arctic Tundra
"In a small town, Sarah overcame obstacles. Through this experience, they learned that kindness matters. Eventually, they found inner strength.",Lessons in Kindness Matters
"During a challenging time, Emma faced a difficult decision. Through this experience, they learned that perseverance pays off. Eventually, they helped their community.",Path to Perseverance Pays Off
"A person named Lisa faced a difficult decision. Through this experience, they learned that kindness matters. Eventually, they found inner strength.",Lessons in Kindness Matters
"During a challenging time, Michael learned an important lesson. Through this experience, they learned that kindness matters. Eventually, they found inner strength.",Story of Kindness Matters
"A person named David learned an important lesson. Through this experience, they learned that change brings growth. Eventually, they found inner strength.",Journey of Change Brings Growth
In the depths of ocean depths. an unexpected change occurred. Researchers observed ecological patterns.,Wonders of Ocean Depths
"During a challenging time, Emma overcame obstacles. Through this experience, they learned that kindness matters. Eventually, they helped their community.",Journey of Kindness Matters
Across the vast desert landscape. an unexpected change occurred. Local inhabitants witnessed natural phenomena.,Discovery in Desert Landscape
Deep within arctic tundra. nature revealed its secrets. Local inhabitants witnessed natural phenomena.,Wonders of Arctic Tundra
Deep within desert landscape. a remarkable discovery was made. Local inhabitants witnessed natural phenomena.,Wonders of Desert Landscape
Scientists working at prestigious university announced new discovery. This development might revolutionize industries.,Future of Announced
"During a challenging time, Emma faced a difficult decision. Through this experience, they learned that perseverance pays off. Eventually, they found inner strength.",Journey of Perseverance Pays Off
Across the vast mountain range. an unexpected change occurred. Scientists found ancient artifacts.,Mysteries of Mountain Range
Deep within mountain range. an unexpected change occurred. Local inhabitants witnessed unique behaviors.,Secrets of Mountain Range
Scientists working at leading tech company made significant progress. This development might revolutionize industries.,Tech Revolution: Made
"During a challenging time, Lisa overcame obstacles. Through this experience, they learned that perseverance pays off. Eventually, they achieved their dreams.",Story of Perseverance Pays Off
"A person named Michael faced a difficult decision. Through this experience, they learned that kindness matters. Eventually, they helped their community.",Path to Kindness Matters
Scientists working at prestigious university announced new discovery. This development might revolutionize industries.,Innovation: Announced
Scientists working at research institute announced new discovery. The innovation could transform daily life.,Future of Announced
Deep within arctic tundra. an unexpected change occurred. Scientists found rare species.,Wonders of Arctic Tundra
Across the vast arctic tundra. a remarkable discovery was made. Scientists found ancient artifacts.,Wonders of Arctic Tundra
Across the vast ancient forest. a remarkable discovery was made. Local inhabitants witnessed ecological patterns.,Wonders of Ancient Forest
Scientists working at leading tech company made significant progress. The technology enables solve global challenges.,Innovation: Made
Deep within ocean depths. nature revealed its secrets. Researchers observed natural phenomena.,Wonders of Ocean Depths
Engineers from prestigious university developed breakthrough technology. The technology enables solve global challenges.,Breakthrough in Developed
"A person named Sarah learned an important lesson. Through this experience, they learned that kindness matters. Eventually, they achieved their dreams.",Journey of Kindness Matters
"During a challenging time, Sarah overcame obstacles. Through this experience, they learned that change brings growth. Eventually, they found inner strength.",Journey of Change Brings Growth
"During a challenging time, Lisa overcame obstacles. Through this experience, they learned that perseverance pays off. Eventually, they helped their community.",Path to Perseverance Pays Off
"During a challenging time, Sarah faced a difficult decision. Through this experience, they learned that change brings growth. Eventually, they found inner strength.",Journey of Change Brings Growth
Researchers at research institute announced new discovery. This development might revolutionize industries.,Tech Revolution: Announced
Researchers at prestigious university announced new discovery. The technology enables revolutionize industries.,Breakthrough in Announced
Across the vast ancient forest. nature revealed its secrets. Local inhabitants witnessed ecological patterns.,Wonders of Ancient Forest
Researchers at innovation lab announced new discovery. The innovation could solve global challenges.,Innovation: Announced
In the depths of ocean depths. a remarkable discovery was made. Scientists found ecological patterns.,Wonders of Ocean Depths
Engineers from leading tech company made significant progress. The innovation could transform daily life.,Future of Made
"During a challenging time, Michael faced a difficult decision. Through this experience, they learned that kindness matters. Eventually, they helped their community.",Story of Kindness Matters
"In a small town, Lisa faced a difficult decision. Through this experience, they learned that change brings growth. Eventually, they achieved their dreams.",Lessons in Change Brings Growth
Scientists working at leading tech company announced new discovery. This development might transform daily life.,Innovation: Announced
Scientists working at innovation lab developed breakthrough technology. The innovation could revolutionize industries.,Future of Developed
"During a challenging time, Lisa learned an important lesson. Through this experience, they learned that change brings growth. Eventually, they achieved their dreams.",Lessons in Change Brings Growth
Scientists working at prestigious university made significant progress. The technology enables transform daily life.,Innovation: Made
"During a challenging time, Lisa faced a difficult decision. Through this experience, they learned that change brings growth. Eventually, they found inner strength.",Story of Change Brings Growth
Scientists working at research institute announced new discovery. The technology enables transform daily life.,Future of Announced
"In a small town, Sarah faced a difficult decision. Through this experience, they learned that perseverance pays off. Eventually, they helped their community.",Lessons in Perseverance Pays Off
Across the vast ocean depths. an unexpected change occurred. Local inhabitants witnessed rare species.,Wonders of Ocean Depths
In the depths of mountain range. a remarkable discovery was made. Local inhabitants witnessed ancient artifacts.,Secrets of Mountain Range
"During a challenging time, Sarah overcame obstacles. Through this experience, they learned that perseverance pays off. Eventually, they found inner strength.",Lessons in Perseverance Pays Off
"A person named Lisa overcame obstacles. Through this experience, they learned that change brings growth. Eventually, they helped their community.",Path to Change Brings Growth
"In a small town, Sarah faced a difficult decision. Through this experience, they learned that kindness matters. Eventually, they achieved their dreams.",Lessons in Kindness Matters
"During a challenging time, Sarah overcame obstacles. Through this experience, they learned that change brings growth. Eventually, they achieved their dreams.",Path to Change Brings Growth
"During a challenging time, David learned an important lesson. Through this experience, they learned that kindness matters. Eventually, they achieved their dreams.",Path to Kindness Matters
Researchers at innovation lab made significant progress. This development might solve global challenges.,Future of Made
Deep within desert landscape. an unexpected change occurred. Scientists found ecological patterns.,Mysteries of Desert Landscape
Researchers at research institute made significant progress. The innovation could solve global challenges.,Future of Made
Engineers from leading tech company announced new discovery. The technology enables revolutionize industries.,Future of Announced
"During a challenging time, Emma overcame obstacles. Through this experience, they learned that perseverance pays off. Eventually, they found inner strength.",Lessons in Perseverance Pays Off
Researchers at research institute announced new discovery. The technology enables transform daily life.,Innovation: Announced
"During a challenging time, David learned an important lesson. Through this experience, they learned that perseverance pays off. Eventually, they achieved their dreams.",Path to Perseverance Pays Off
Engineers from leading tech company made significant progress. This development might revolutionize industries.,Future of Made
"During a challenging time, Michael learned an important lesson. Through this experience, they learned that change brings growth. Eventually, they found inner strength.",Journey of Change Brings Growth
Deep within arctic tundra. nature revealed its secrets. Researchers observed ecological patterns.,Discovery in Arctic Tundra
In the depths of mountain range. nature revealed its secrets. Scientists found ecological patterns.,Secrets of Mountain Range
"In a small town, Sarah faced a difficult decision. Through this experience, they learned that perseverance pays off. Eventually, they achieved their dreams.",Lessons in Perseverance Pays Off
"In a small town, Michael faced a difficult decision. Through this experience, they learned that perseverance pays off. Eventually, they achieved their dreams.",Path to Perseverance Pays Off
Deep within arctic tundra. nature revealed its secrets. Scientists found rare species.,Wonders of Arctic Tundra
In the depths of mountain range. a remarkable discovery was made. Scientists found rare species.,Mysteries of Mountain Range
In the depths of desert landscape. a remarkable discovery was made. Researchers observed ecological patterns.,Mysteries of Desert Landscape
Engineers from innovation lab announced new discovery. The technology enables transform daily life.,Breakthrough in Announced
In the depths of ancient forest. a remarkable discovery was made. Local inhabitants witnessed ecological patterns.,Secrets of Ancient Forest
Deep within mountain range. a remarkable discovery was made. Scientists found rare species.,Mysteries of Mountain Range
"In a small town, Lisa overcame obstacles. Through this experience, they learned that kindness matters. Eventually, they achieved their dreams.",Story of Kindness Matters
Scientists working at research institute made significant progress. The technology enables revolutionize industries.,Breakthrough in Made
"A person named Sarah overcame obstacles. Through this experience, they learned that perseverance pays off. Eventually, they helped their community.",Lessons in Perseverance Pays Off
Across the vast ocean depths. a remarkable discovery was made. Scientists found unique behaviors.,Secrets of Ocean Depths
Across the vast mountain range. nature revealed its secrets. Scientists found rare species.,Secrets of Mountain Range
"A person named Lisa faced a difficult decision. Through this experience, they learned that perseverance pays off. Eventually, they helped their community.",Journey of Perseverance Pays Off
"A person named Emma faced a difficult decision. Through this experience, they learned that kindness matters. Eventually, they helped their community.",Journey of Kindness Matters
Across the vast ocean depths. nature revealed its secrets. Researchers observed unique behaviors.,Discovery in Ocean Depths
Across the vast ocean depths. an unexpected change occurred. Local inhabitants witnessed unique behaviors.,Mysteries of Ocean Depths
Deep within desert landscape. nature revealed its secrets. Researchers observed ancient artifacts.,Wonders of Desert Landscape
Researchers at leading tech company made significant progress. The technology enables transform daily life.,Breakthrough in Made
Engineers from research institute developed breakthrough technology. The innovation could transform daily life.,Future of Developed
"In a small town, Michael learned an important lesson. Through this experience, they learned that perseverance pays off. Eventually, they achieved their dreams.",Lessons in Perseverance Pays Off
Across the vast ocean depths. nature revealed its secrets. Local inhabitants witnessed natural phenomena.,Discovery in Ocean Depths
Engineers from leading tech company announced new discovery. The innovation could revolutionize industries.,Tech Revolution: Announced
Deep within ocean depths. an unexpected change occurred. Researchers observed ancient artifacts.,Secrets of Ocean Depths
Scientists working at research institute announced new discovery. The technology enables revolutionize industries.,Tech Revolution: Announced
Scientists working at prestigious university announced new discovery. The innovation could solve global challenges.,Future of Announced
Across the vast ancient forest. nature revealed its secrets. Scientists found ancient artifacts.,Secrets of Ancient Forest
In the depths of mountain range. an unexpected change occurred. Researchers observed ancient artifacts.,Wonders of Mountain Range
Engineers from research institute made significant progress. The innovation could revolutionize industries.,Breakthrough in Made
"A person named Michael learned an important lesson. Through this experience, they learned that perseverance pays off. Eventually, they found inner strength.",Path to Perseverance Pays Off
Scientists working at prestigious university developed breakthrough technology. This development might solve global challenges.,Innovation: Developed
"A person named Michael learned an important lesson. Through this experience, they learned that perseverance pays off. Eventually, they found inner strength.",Lessons in Perseverance Pays Off
"A person named Michael faced a difficult decision. Through this experience, they learned that change brings growth. Eventually, they helped their community.",Journey of Change Brings Growth
Deep within ancient forest. a remarkable discovery was made. Scientists found natural phenomena.,Mysteries of Ancient Forest
Deep within ancient forest. a remarkable discovery was made. Researchers observed ecological patterns.,Wonders of Ancient Forest
"In a small town, Emma overcame obstacles. Through this experience, they learned that kindness matters. Eventually, they helped their community.",Path to Kindness Matters
"During a challenging time, David overcame obstacles. Through this experience, they learned that change brings growth. Eventually, they achieved their dreams.",Story of Change Brings Growth
Scientists working at innovation lab made significant progress. The technology enables solve global challenges.,Tech Revolution: Made
Engineers from research institute developed breakthrough technology. This development might transform daily life.,Tech Revolution: Developed
Deep within arctic tundra. a remarkable discovery was made. Scientists found natural phenomena.,Wonders of Arctic Tundra
Scientists working at leading tech company developed breakthrough technology. The technology enables revolutionize industries.,Innovation: Developed
Deep within ancient forest. a remarkable discovery was made. Researchers observed ancient artifacts.,Wonders of Ancient Forest
Across the vast mountain range. an unexpected change occurred. Local inhabitants witnessed ecological patterns.,Wonders of Mountain Range
Researchers at innovation lab announced new discovery. The innovation could revolutionize industries.,Future of Announced
Engineers from leading tech company made significant progress. The technology enables revolutionize industries.,Future of Made
Deep within ancient forest. nature revealed its secrets. Scientists found ecological patterns.,Secrets of Ancient Forest
Across the vast desert landscape. nature revealed its secrets. Local inhabitants witnessed rare species.,Secrets of Desert Landscape
Researchers at prestigious university developed breakthrough technology. The technology enables revolutionize industries.,Innovation: Developed
"A person named Lisa learned an important lesson. Through this experience, they learned that change brings growth. Eventually, they helped their community.",Story of Change Brings Growth
Scientists working at research institute developed breakthrough technology. The innovation could solve global challenges.,Breakthrough in Developed
Scientists working at innovation lab announced new discovery. The technology enables solve global challenges.,Future of Announced
"In a small town, Michael faced a difficult decision. Through this experience, they learned that perseverance pays off. Eventually, they helped their community.",Story of Perseverance Pays Off
"During a challenging time, Emma learned an important lesson. Through this experience, they learned that change brings growth. Eventually, they achieved their dreams.",Journey of Change Brings Growth
Scientists working at leading tech company developed breakthrough technology. This development might transform daily life.,Future of Developed
"In a small town, David overcame obstacles. Through this experience, they learned that change brings growth. Eventually, they found inner strength.",Path to Change Brings Growth
"A person named Emma overcame obstacles. Through this experience, they learned that kindness matters. Eventually, they helped their community.",Path to Kindness Matters
Researchers at prestigious university made significant progress. This development might transform daily life.,Tech Revolution: Made
Across the vast ocean depths. nature revealed its secrets. Scientists found ancient artifacts.,Mysteries of Ocean Depths
"During a challenging time, Sarah overcame obstacles. Through this experience, they learned that perseverance pays off. Eventually, they achieved their dreams.",Path to Perseverance Pays Off
"During a challenging time, Michael overcame obstacles. Through this experience, they learned that change brings growth. Eventually, they found inner strength.",Lessons in Change Brings Growth
"During a challenging time, Emma faced a difficult decision. Through this experience, they learned that perseverance pays off. Eventually, they helped their community.",Path to Perseverance Pays Off
"In a small town, Lisa overcame obstacles. Through this experience, they learned that change brings growth. Eventually, they helped their community.",Lessons in Change Brings Growth
Engineers from innovation lab developed breakthrough technology. The innovation could solve global challenges.,Future of Developed
In the depths of ancient forest. nature revealed its secrets. Researchers observed unique behaviors.,Wonders of Ancient Forest
"During a challenging time, Lisa overcame obstacles. Through this experience, they learned that kindness matters. Eventually, they found inner strength.",Story of Kindness Matters
Engineers from prestigious university made significant progress. The technology enables transform daily life.,Innovation: Made
Scientists working at leading tech company made significant progress. The technology enables transform daily life.,Breakthrough in Made
In the depths of arctic tundra. an unexpected change occurred. Scientists found natural phenomena.,Secrets of Arctic Tundra
"During a challenging time, Michael faced a difficult decision. Through this experience, they learned that change brings growth. Eventually, they helped their community.",Path to Change Brings Growth
"During a challenging time, Sarah learned an important lesson. Through this experience, they learned that kindness matters. Eventually, they achieved their dreams.",Path to Kindness Matters
Across the vast ocean depths. an unexpected change occurred. Researchers observed rare species.,Secrets of Ocean Depths
Deep within arctic tundra. nature revealed its secrets. Scientists found natural phenomena.,Discovery in Arctic Tundra
Across the vast mountain range. an unexpected change occurred. Local inhabitants witnessed rare species.,Wonders of Mountain Range
"In a small town, Emma overcame obstacles. Through this experience, they learned that perseverance pays off. Eventually, they helped their community.",Story of Perseverance Pays Off
Engineers from research institute made significant progress. This development might revolutionize industries.,Breakthrough in Made
Scientists working at prestigious university developed breakthrough technology. This development might revolutionize industries.,Innovation: Developed
Across the vast ocean depths. a remarkable discovery was made. Local inhabitants witnessed unique behaviors.,Secrets of Ocean Depths
Scientists working at prestigious university announced new discovery. The technology enables revolutionize industries.,Innovation: Announced
Scientists working at innovation lab developed breakthrough technology. The technology enables revolutionize industries.,Future of Developed
Across the vast desert landscape. nature revealed its secrets. Scientists found unique behaviors.,Discovery in Desert Landscape
Engineers from research institute made significant progress. This development might revolutionize industries.,Innovation: Made
Deep within ancient forest. a remarkable discovery was made. Scientists found natural phenomena.,Secrets of Ancient Forest
Scientists working at innovation lab made significant progress. The innovation could solve global challenges.,Innovation: Made
"A person named Emma faced a difficult decision. Through this experience, they learned that kindness matters. Eventually, they achieved their dreams.",Journey of Kindness Matters
"A person named Michael overcame obstacles. Through this experience, they learned that change brings growth. Eventually, they helped their community.",Journey of Change Brings Growth
Scientists working at leading tech company announced new discovery. The technology enables solve global challenges.,Tech Revolution: Announced
Deep within desert landscape. an unexpected change occurred. Scientists found unique behaviors.,Discovery in Desert Landscape
Scientists working at research institute announced new discovery. The technology enables revolutionize industries.,Future of Announced
"A person named David overcame obstacles. Through this experience, they learned that perseverance pays off. Eventually, they helped their community.",Path to Perseverance Pays Off
Across the vast desert landscape. an unexpected change occurred. Scientists found unique behaviors.,Secrets of Desert Landscape
Researchers at prestigious university made significant progress. This development might transform daily life.,Tech Revolution: Made
Engineers from innovation lab announced new discovery. The technology enables transform daily life.,Future of Announced
Deep within arctic tundra. nature revealed its secrets. Researchers observed unique behaviors.,Discovery in Arctic Tundra
Engineers from leading tech company made significant progress. This development might revolutionize industries.,Innovation: Made
Scientists working at prestigious university developed breakthrough technology. This development might revolutionize industries.,Innovation: Developed
"In a small town, Emma faced a difficult decision. Through this experience, they learned that kindness matters. Eventually, they achieved their dreams.",Journey of Kindness Matters
"During a challenging time, Lisa overcame obstacles. Through this experience, they learned that perseverance pays off. Eventually, they helped their community.",Story of Perseverance Pays Off
"In a small town, Michael overcame obstacles. Through this experience, they learned that kindness matters. Eventually, they found inner strength.",Path to Kindness Matters
Deep within ancient forest. nature revealed its secrets. Researchers observed unique behaviors.,Mysteries of Ancient Forest
Scientists working at leading tech company developed breakthrough technology. This development might solve global challenges.,Tech Revolution: Developed
